cif,company_name,caen_code,caen_description,county
15073400,SC DACIA PROD SRL,4941,Transporturi rutiere de marfuri,Sibiu
15073450,VLAD COM SRL,4711,"Comert cu amanuntul in magazine nespecializate, cu vanzare predominanta de produse alimentare, bauturi si tutun",Sibiu
15085854,CONS MAN SRL,7022,Activitati de consultanta pentru afaceri si management,Sibiu
15085862,SC AGRO DOGALI SRL,150,Activitati in ferme mixte (cultura vegetala combinata cu cresterea animalelor),Sibiu
15085889,CAMA SRL,4673,Comert cu ridicata al materialului lemnos si al materialelor de constructii si echipamentelor sanitare,Sibiu
15085897,SC DANY REX SRL,9609,Alte activitati de servicii n.c.a.,Sibiu
15091538,S.C. RAOULTEX SRL,7022,Activitati de consultanta pentru afaceri si management,Sibiu
15091554,LUCMAN SRL,4322,"Lucrari de instalatii sanitare, de incalzire si de aer conditionat",Sibiu
15091570,S.C. TOTAL CONECT SRL,4321,Lucrari de instalatii electrice,Sibiu
15091597,KAIROS SRL,8622,Activitati de asistenta medicala specializata,Sibiu
15091627,S.C. DECOLUX S.R.L.,3101,Fabricarea de mobila pentru birouri si magazine,Sibiu
15103357,PROTECH COMPANY SRL,9511,Repararea calculatoarelor si a echipamentelor periferice,Sibiu
15103403,PROIT SRL,6201,Activitati de realizare a soft-ului la comanda (software orientat client),Sibiu
15103446,AXXA CONSULT S.R.L.,7022,Activitati de consultanta pentru afaceri si management,Sibiu
15110826,SC.TIMELINE BUSINESS SYSTEMS S,6201,Activitati de realizare a soft-ului la comanda (software orientat client),Sibiu
15110869,S.C.SUCIU AL.SERV.SRL,4520,Intretinerea si repararea autovehiculelor,Sibiu
15121302,SC REVELINE SRL,1411,Fabricarea articolelor de imbracaminte din piele,Sibiu
15121329,EM PLUS S.R.L.,4619,Intermedieri in comertul cu produse diverse,Sibiu
15121337,INFO GOTT SRL,4690,Comert cu ridicata nespecializat,Sibiu
15121345,S.C.ALEMI S.R.L.,2561,Tratarea si acoperirea metalelor,Sibiu
15121353,S.C. TEHNO GERULEX S.R.L.,4618,"Intermedieri in comertul specializat in vanzarea produselor cu caracter specific, n.c.a.",Sibiu
15121361,SC FRESH TOOLS SRL,7022,Activitati de consultanta pentru afaceri si management,Sibiu
15121370,OP DESIGN SRL,7111,Activitati de arhitectura,Sibiu
15121396,ADICON IMPEX SRL,4120,Lucrari de constructii a cladirilor rezidentiale si nerezidentiale,Sibiu
15121906,TONDACH ROMANIA SRL,4673,Comert cu ridicata al materialului lemnos si al materialelor de constructii si echipamentelor sanitare,Sibiu
15123346,I.T.N.T. SRL,6312,Activitati ale portalurilor web,Sibiu
15123354,DINAMIC PLUS SRL,6831,Agentii imobiliare,Sibiu
15123389,S.C. AUDITCONT S.R.L.,6920,"Activitati de contabilitate si audit financiar, consultanta in domeniul fiscal",Sibiu
15123400,ATMA SPORT SRL,150,Activitati in ferme mixte (cultura vegetala combinata cu cresterea animalelor),Sibiu
15123443,S.C. IMAGE SRL,7311,Activitati ale agentiilor de publicitate,Sibiu
15123460,JOMRO TEXTILTECHNIK ROMANIA SRL,4664,Comert cu ridicata al masinilor pentru industria textila si al masinilor de cusut si de tricotat,Sibiu
15123478,SC BIA STAR S.R.L.,4939,Alte transporturi terestre de calatori n.c.a,Sibiu
15130009,ANDRA 2003 S.R.L.,4719,"Comert cu amanuntul in magazine nespecializate, cu vanzare predominanta de produse nealimentare",Sibiu
15130025,EM2SOFT S.R.L.,6201,Activitati de realizare a soft-ului la comanda (software orientat client),Sibiu
15130076,TATRU COM SRL,4719,"Comert cu amanuntul in magazine nespecializate, cu vanzare predominanta de produse nealimentare",Sibiu
15134736,TRANSYLVANIA IMPROVEMENT COMPANY SRL,7022,Activitati de consultanta pentru afaceri si management,Sibiu
15138134,SC NM PREST COM SRL,4751,"Comert cu amanuntul al textilelor, in magazine specializate",Sibiu
15138150,OK BOBO SRL,4711,"Comert cu amanuntul in magazine nespecializate, cu vanzare predominanta de produse alimentare, bauturi si tutun",Sibiu
15138177,X VENTURE SRL,7712,Activitati de inchiriere si leasing cu autovehicule rutiere grele,Sibiu
15155623,BADI INSTAL PROD SRL,4322,"Lucrari de instalatii sanitare, de incalzire si de aer conditionat",Sibiu
15155631,IMBISSSTUBE SRL,4711,"Comert cu amanuntul in magazine nespecializate, cu vanzare predominanta de produse alimentare, bauturi si tutun",Sibiu
15155640,MEDSANA VEST SRL,8621,Activitati de asistenta medicala generala,Sibiu
15155666,LEGIS CONT SRL,6920,"Activitati de contabilitate si audit financiar, consultanta in domeniul fiscal",Sibiu
15155682,ZALI FOREST SRL,220,Exploatare forestiera,Sibiu
15155690,S.C.BELDEAN MED SRL server,8622,Activitati de asistenta medicala specializata,Sibiu
15155704,SC M D MARIDA SRL,4532,Comert cu amanuntul de piese si accesorii pentru autovehicule,Sibiu
15155712,S.C.RIPCON SRL,4120,Lucrari de constructii a cladirilor rezidentiale si nerezidentiale,Sibiu
15155747,GENY TRANS SRL,4771,"Comert cu amanuntul al imbracamintei, in magazine specializate",Sibiu
15155755,PSV PROIECT SRL,7111,Activitati de arhitectura,Sibiu
15155771,SORIMAR COM,4711,"Comert cu amanuntul in magazine nespecializate, cu vanzare predominanta de produse alimentare, bauturi si tutun",Sibiu
15155798,ARDELEANA COM SRL,1610,Taierea si rindeluirea lemnului,Sibiu
15155828,BRAT-VETCOM SRL,7500,Activitati veterinare,Sibiu
15174250,S.C. BRADUL ARDELEAN S.R.L.,1623,"Fabricarea altor elemente de dulgherie si tamplarie, pentru constructii",Sibiu
15174277,ARHIP ART SRL,1812,Alte activitati de tiparire n.c.a.,Sibiu
15174307,CONSULTING FIN SRL,6920,"Activitati de contabilitate si audit financiar, consultanta in domeniul fiscal",Sibiu
15174331,CLAUVI IMPEX SRL,4771,"Comert cu amanuntul al imbracamintei, in magazine specializate",Sibiu
15174358,ESPAC COM SRL,1083,Prelucrarea ceaiului si cafelei,Sibiu
15174366,S.C. NADOR S.R.L.,4932,Transporturi cu taxiuri,Sibiu
15174374,SHAMBALA SRL,7112,Activitati de inginerie si consultanta tehnica legate de acestea,Sibiu
15174382,EURO INTERNATIONAL SRL,7911,Activitati ale agentiilor turistice,Sibiu
15174390,SC FABI COM SRL,4771,"Comert cu amanuntul al imbracamintei, in magazine specializate",Sibiu
15174412,SC ELECTRODI SRL,4754,"Comert cu amanuntul al articolelor si aparatelor electrocasnice, in magazine specializate",Sibiu
15174447,TIANCO SRL,4719,"Comert cu amanuntul in magazine nespecializate, cu vanzare predominanta de produse nealimentare",Sibiu
15174455,S.C.VALEMI  S.R.L.,4322,"Lucrari de instalatii sanitare, de incalzire si de aer conditionat",Sibiu
15188426,S.C. ANTARIO S.R.L.,4651,"Comert cu ridicata al calculatoarelor, echipamentelor periferice si software- ului",Sibiu
15188450,POLIEDRICA SRL,6399,Alte activitati de servicii informationale n.c.a.,Sibiu
15188485,SC VELDI SRL,2511,Fabricarea de constructii metalice si parti componente ale structurilor metalice,Sibiu
15188515,SANAS SRL,8621,Activitati de asistenta medicala generala,Sibiu
15188566,SC SILVACOM IMPEX SRL,220,Exploatare forestiera,Sibiu
15188620,S.C.MARCOPAN SRL,4711,"Comert cu amanuntul in magazine nespecializate, cu vanzare predominanta de produse alimentare, bauturi si tutun",Sibiu
15188639,COSMO MEDIA SRL,5911,"Activitati de productie cinematografica, video si de programe de televiziune",Sibiu
15188655,HABIV SRL,1610,Taierea si rindeluirea lemnului,Sibiu
15194428,S.C. COMACTIV S.R.L.,4676,Comert cu ridicata al altor produse intermediare,Sibiu
15194517,SC DAEMED SRL,4532,Comert cu amanuntul de piese si accesorii pentru autovehicule,Sibiu
15206271,MIRATUR SRL,5520,Facilitati de cazare pentru vacante si perioade de scurta durata,Sibiu
15206280,R.I.M. CONSTRUCT SRL,4399,Alte lucrari speciale de constructii n.c.a.,Sibiu
15206301,FOCUS TEAM,8559,Alte forme de invatamant n.c.a.,Sibiu
15206310,SC TEHNOFLUID SRL,2511,Fabricarea de constructii metalice si parti componente ale structurilor metalice,Sibiu
15206344,sc barex consulting srl,7022,Activitati de consultanta pentru afaceri si management,Sibiu
15214592,SC SIM SOFT SRL,6201,Activitati de realizare a soft-ului la comanda (software orientat client),Sibiu
15214622,ABSOLUT SRL,4690,Comert cu ridicata nespecializat,Sibiu
15223523,THOMAS FASCHING SRL,2932,Fabricarea altor piese si accesorii pentru autovehicule si pentru motoare de autovehicule,Sibiu
15228938,IMPERA TRADING S.R.L.,4322,"Lucrari de instalatii sanitare, de incalzire si de aer conditionat",Sibiu
15228946,PROFARM SRL,4646,Comert cu ridicata al produselor farmaceutice,Sibiu
15228954,AUTO   AS  COMPANY   SRL,4520,Intretinerea si repararea autovehiculelor,Sibiu
15229038,S.C. EXTRA TOUR SRL,7911,Activitati ale agentiilor turistice,Sibiu
15229062,S.C. MICHELSBERG MANAGEMENT SRL,4673,Comert cu ridicata al materialului lemnos si al materialelor de constructii si echipamentelor sanitare,Sibiu
15233985,BASTY SRL,4759,"Comert cu amanuntul al mobilei, al articolelor de iluminat si al articolelor de uz casnic n.c.a., in magazine specializate",Sibiu
15234026,SC MISAN MED SRL,8622,Activitati de asistenta medicala specializata,Sibiu
15234131,KIWIAN   CO SRL,5530,"Parcuri pentru rulote, campinguri si tabere",Sibiu
15234140,SC DRADENT SERV SRL,8623,Activitati de asistenta stomatologica,Sibiu
15247166,S.C. COLOSSEUM S.R.L.,4642,Comert cu ridicata al imbracamintei si incaltamintei,Sibiu
15247190,NORDEX S.R.L.,6820,Inchirierea si subinchirierea bunurilor imobiliare proprii sau inchiriate,Sibiu
15247212,SC GRITMAR SRL,4771,"Comert cu amanuntul al imbracamintei, in magazine specializate",Sibiu
15247239,POPAS LUPESCU SRL,5610,Restaurante,Sibiu
15253850,SALZBURG SRL,4120,Lucrari de constructii a cladirilor rezidentiale si nerezidentiale,Sibiu
15253869,S.C. AMN DEVELOPMENT SRL,6820,Inchirierea si subinchirierea bunurilor imobiliare proprii sau inchiriate,Sibiu
15253877,S.C. CADOURI SIB S.R.L.,4719,"Comert cu amanuntul in magazine nespecializate, cu vanzare predominanta de produse nealimentare",Sibiu
15265847,S.C.EXPRO CONTA SRL,6920,"Activitati de contabilitate si audit financiar, consultanta in domeniul fiscal",Sibiu
15265855,S.C. EURO COMTRANS SRL,4939,Alte transporturi terestre de calatori n.c.a,Sibiu
15265880,SC TEREZA COM SRL,4711,"Comert cu amanuntul in magazine nespecializate, cu vanzare predominanta de produse alimentare, bauturi si tutun",Sibiu
15265901,SC CINDRELUL IMPEX SRL,1610,Taierea si rindeluirea lemnului,Sibiu
15265910,S.C CDI COMPANY SRL,4110,Dezvoltare (promovare) imobiliara,Sibiu
15272968,SC IDA CONS SRL,7022,Activitati de consultanta pentru afaceri si management,Sibiu
15274470,SC TEHNICA DE AUTOMATIZARE SIBIU SRL,7112,Activitati de inginerie si consultanta tehnica legate de acestea,Sibiu
15274535,M.C.A LOGISTIC SRL,5610,Restaurante,Sibiu
15274560,MARESIU COM SRL,4751,"Comert cu amanuntul al textilelor, in magazine specializate",Sibiu
15274594,EUROPARC SRL,5510,Hoteluri si alte facilitati de cazare similare,Sibiu
15274608,S.C. URBAN DESIGN,7111,Activitati de arhitectura,Sibiu
15274691,S.C.INTERCON TRADING SRL,4120,Lucrari de constructii a cladirilor rezidentiale si nerezidentiale,Sibiu
15285666,TRANSILVANIA TATTOO SRL,9609,Alte activitati de servicii n.c.a.,Sibiu
15285674,SC PERFECT JOB SRL,4619,Intermedieri in comertul cu produse diverse,Sibiu
15285682,S.C. GANESHA S.R.L.,4729,"Comert cu amanuntul al altor produse alimentare, in magazine specializate",Sibiu
15285712,S.C. B&B EUROTERM SRL server,4322,"Lucrari de instalatii sanitare, de incalzire si de aer conditionat",Sibiu
15285755,S.C. MARI PAN SRL,1071,"Fabricarea painii, fabricarea prajiturilor si a produselor proaspete de patiserie",Sibiu
15285798,SC SIMBA CONSTRUCT SRL,4322,"Lucrari de instalatii sanitare, de incalzire si de aer conditionat",Sibiu
15285836,SC FAN JOKER SRL,5320,Alte activitati postale si de curier,Sibiu
15285887,S.C. PETROLIV SRL,4671,"Comert cu ridicata al combustibililor solizi, lichizi si gazosi al produselor derivate",Sibiu
15292450,WALLACE IMPEX SRL,7022,Activitati de consultanta pentru afaceri si management,Sibiu
15292523,SILVIU  COMPANY,4719,"Comert cu amanuntul in magazine nespecializate, cu vanzare predominanta de produse nealimentare",Sibiu
15292531,M &amp;amp;A  AUDICONT  SRL,6920,"Activitati de contabilitate si audit financiar, consultanta in domeniul fiscal",Sibiu
15302848,SIB PLAST CONSTRUCT SRL,3832,Recuperarea materialelor reciclabile sortate,Sibiu
15302872,SC TOSCANA  SRL,4120,Lucrari de constructii a cladirilor rezidentiale si nerezidentiale,Sibiu
15302880,S.C. I-INTERMED CONSULT SRL,7830,Servicii de furnizare si management a fortei de munca,Sibiu
15307993,SC OPTIM DESIGN SRL,1813,Servicii pregatitoare pentru pretiparire,Sibiu
15308018,S.C. Luccas Trans S.R.L.,4711,"Comert cu amanuntul in magazine nespecializate, cu vanzare predominanta de produse alimentare, bauturi si tutun",Sibiu
15319580,SC ROL CONT EXPERT SRL,6920,"Activitati de contabilitate si audit financiar, consultanta in domeniul fiscal",Sibiu
15319637,SC DARMEK SRL,4632,Comert cu ridicata al carnii si produselor din carne,Sibiu
15319645,SC  LEON  TRADE SRL,4711,"Comert cu amanuntul in magazine nespecializate, cu vanzare predominanta de produse alimentare, bauturi si tutun",Sibiu
15319653,TRANSMILIONUL SRL,4941,Transporturi rutiere de marfuri,Sibiu
15327001,SC NTN-SNR RULMENTI SRL,2815,"Fabricarea lagarelor, angrenajelor, cutiilor de viteza si a elementelor mecanice de transmisie",Sibiu
15337587,K & A EXPRESS SRL,5630,Baruri si alte activitati de servire a bauturilor,Sibiu
15337609,VASIL  COM  PREST  SRL,4771,"Comert cu amanuntul al imbracamintei, in magazine specializate",Sibiu
15346488,ROMEXA CON SRL,4120,Lucrari de constructii a cladirilor rezidentiale si nerezidentiale,Sibiu
15346496,GRUPUL EDITORIAL COSMOS,5811,Activitati de editare a cartilor,Sibiu
15346518,ADI SI NICOL SRL,5610,Restaurante,Sibiu
15346534,S.C TANO MEDICA SRL,8622,Activitati de asistenta medicala specializata,Sibiu
15346585,VIAGI  COM  SRL,1610,Taierea si rindeluirea lemnului,Sibiu
15346593,NIVAL COM SRL,1610,Taierea si rindeluirea lemnului,Sibiu
15346615,SC TRANS CINDREL SRL,7712,Activitati de inchiriere si leasing cu autovehicule rutiere grele,Sibiu
15360717,CATALIN MOB SRL,3109,Fabricarea de mobila n.c.a.,Sibiu
15360768,SC MAXIMM AUTO SRL,7022,Activitati de consultanta pentru afaceri si management,Sibiu
15360784,SC PERSONAL EVIDENT JOB SRL,7810,Activitati ale agentiilor de plasare a fortei de munca,Sibiu
15360822,AUTO ZONE SRL,4532,Comert cu amanuntul de piese si accesorii pentru autovehicule,Sibiu
15364140,CARPALAT S.R.L.,1051,Fabricarea produselor lactate si a branzeturilor,Sibiu
15364158,SC PESONAL SERVICE SRL,7810,Activitati ale agentiilor de plasare a fortei de munca,Sibiu
15364174,TIFFANY & COLE S.R.L.,5610,Restaurante,Sibiu
15364255,S.C. DANTARSIB SRL,4120,Lucrari de constructii a cladirilor rezidentiale si nerezidentiale,Sibiu
15364271,S.C. Automobile Hermannstadt S.R.L.,4511,"Comert cu autoturisme si autovehicule usoare (sub 3,5 tone)",Sibiu
15364298,BELLA SIB S.R.L.,4771,"Comert cu amanuntul al imbracamintei, in magazine specializate",Sibiu
15364336,SC KIOMED SRL,4932,Transporturi cu taxiuri,Sibiu
15376284,LCD CONSULTING SRL,7022,Activitati de consultanta pentru afaceri si management,Sibiu
15376306,MASSEDA SOFTWARE SRL,5829,Activitati de editare a altor produse software,Sibiu
15376322,Voba Voinescu SRL,2593,"Fabricarea articolelor din fire metalice, fabricarea de lanturi si arcuri",Sibiu
15376403,SC MIJA FOREST SRL,210,Silvicultura si alte activitati forestiere,Sibiu
15382740,S.C. CORION SRL,4771,"Comert cu amanuntul al imbracamintei, in magazine specializate",Sibiu
15382766,S.C. CRIVEANU CONSTRUCT SRL,4120,Lucrari de constructii a cladirilor rezidentiale si nerezidentiale,Sibiu
15382812,SUMA SRL,4120,Lucrari de constructii a cladirilor rezidentiale si nerezidentiale,Sibiu
15382847,CATONA SRL,7022,Activitati de consultanta pentru afaceri si management,Sibiu
15382910,MARSPORT SRL,1520,Fabricarea incaltamintei,Sibiu
15382928,THERMIK TRANSYLVANIA SRL,2790,Fabricarea altor echipamente electrice,Sibiu
15382944,BESCHIU PAN S.R.L.,1071,"Fabricarea painii, fabricarea prajiturilor si a produselor proaspete de patiserie",Sibiu
15399172,SC LALEX SRL,1414,Fabricarea de articole de lenjerie de corp,Sibiu
15399199,S.C. GLISSANDO SRL,7112,Activitati de inginerie si consultanta tehnica legate de acestea,Sibiu
15399210,Cooplan SRL,7111,Activitati de arhitectura,Sibiu
15399229,RUBI SIB  SRL,4711,"Comert cu amanuntul in magazine nespecializate, cu vanzare predominanta de produse alimentare, bauturi si tutun",Sibiu
15399253,EL PASO SRL,4624,"Comert cu ridicata al blanurilor, pieilor brute si al pieilor prelucrate",Sibiu
15399261,SC MORFEU SRL,7112,Activitati de inginerie si consultanta tehnica legate de acestea,Sibiu
15399300,SC.SAVANA IMPEX.SRL,1082,"Fabricarea produselor din cacao, a ciocolatei si a produselor zaharoase",Sibiu
15399318,S.C. ENERGOCONSULT SRL SIBIU,7112,Activitati de inginerie si consultanta tehnica legate de acestea,Sibiu
15399342,Fidelio Farm S.R.L.,4646,Comert cu ridicata al produselor farmaceutice,Sibiu
15399423,HERASIB S.R.L.,4690,Comert cu ridicata nespecializat,Sibiu
15399458,S.C. MISTRAL S.R.L.,5630,Baruri si alte activitati de servire a bauturilor,Sibiu
15405487,S.C. NOI S.R.L.,7112,Activitati de inginerie si consultanta tehnica legate de acestea,Sibiu
15405525,SC CRIS COMPUTERS SRL,9511,Repararea calculatoarelor si a echipamentelor periferice,Sibiu
15415561,S.C. TRANS-SILVIU SRL,4941,Transporturi rutiere de marfuri,Sibiu
15415618,ECOART SRL,4332,Lucrari de tamplarie si dulgherie,Sibiu
15415626,"S.C. ""BUSINESS EXPERT"" S.R.L.",6920,"Activitati de contabilitate si audit financiar, consultanta in domeniul fiscal",Sibiu
15415634,S.C. RIMARCO MOB S.R.L.,3102,Fabricarea de mobila pentru bucatarii,Sibiu
15415642,SC NATURIF SRL,4771,"Comert cu amanuntul al imbracamintei, in magazine specializate",Sibiu
15415669,S.C. SIC DESIGN SRL,7111,Activitati de arhitectura,Sibiu
15415782,REDDISON SRL,5510,Hoteluri si alte facilitati de cazare similare,Sibiu
15420312,Proiect Consult SRL,4212,Lucrari de constructii a cailor ferate de suprafata  si subterane,Sibiu
15420371,JEDIKUL SRL,150,Activitati in ferme mixte (cultura vegetala combinata cu cresterea animalelor),Sibiu
15426986,SC TRANSFAGARASAN BALEA SRL,4939,Alte transporturi terestre de calatori n.c.a,Sibiu
15431303,SC DONALI SRL,4719,"Comert cu amanuntul in magazine nespecializate, cu vanzare predominanta de produse nealimentare",Sibiu
15431400,AUTO ROM S.R.L,4932,Transporturi cu taxiuri,Sibiu
15431435,BIT TRANS SRL,4932,Transporturi cu taxiuri,Sibiu
15439528,BIANDRA BAR SRL,4311,Lucrari de demolare a constructiilor,Sibiu
15449556,OVERALL COMPANY SRL,4690,Comert cu ridicata nespecializat,Sibiu
15449580,SC EXPERTWERK ROMANIA SRL,6201,Activitati de realizare a soft-ului la comanda (software orientat client),Sibiu
15451092,ELECTROTECH-IND S.R.L,4643,"Comert cu ridicata al aparatelor electrice de uz gospodaresc, al aparatelor de radio si televizoarelor",Sibiu
15453794,SC GEPRO CONT SRL,6920,"Activitati de contabilitate si audit financiar, consultanta in domeniul fiscal",Sibiu
15453832,KAI FOREST,220,Exploatare forestiera,Sibiu
15466417,ADONIS PROIECT SRL,240,Activitati de servicii anexe silviculturii,Sibiu
15466450,contagen srl,6920,"Activitati de contabilitate si audit financiar, consultanta in domeniul fiscal",Sibiu
15466476,SC CASA CAMPAGNA SRL,150,Activitati in ferme mixte (cultura vegetala combinata cu cresterea animalelor),Sibiu
15466506,MOB UNION S.R.L,6820,Inchirierea si subinchirierea bunurilor imobiliare proprii sau inchiriate,Sibiu
15472206,SC MANICRIS SRL,4722,"Comert cu amanuntul al carnii si al produselor din carne, in magazine specializate",Sibiu
15472214,CONSULT SOPAS SRL,7022,Activitati de consultanta pentru afaceri si management,Sibiu
15472290,SC GRECU COM SRL,5610,Restaurante,Sibiu
15474207,MEDSANA CONSULT SRL,7830,Servicii de furnizare si management a fortei de munca,Sibiu
15474223,AMSO PRO,8559,Alte forme de invatamant n.c.a.,Sibiu
15486040,VALENTINO R M,5520,Facilitati de cazare pentru vacante si perioade de scurta durata,Sibiu
15486082,SPERANTA IMPORT EXPORT SRL,1629,"Fabricarea altor produse din lemn, fabricarea articolelor din pluta, paie si din alte materiale vegetale impletite",Sibiu
15486104,HARTING Romania SCS,4669,Comert cu ridicata al altor masini si echipamente,Sibiu
15486112,HARTING Romania Manufacturing SCS,2611,Fabricarea subansamblurilor electronice (module),Sibiu
15486120,S.C.CONTECH SIB SRL,4322,"Lucrari de instalatii sanitare, de incalzire si de aer conditionat",Sibiu
15486244,SC  NATEALAN SRL,220,Exploatare forestiera,Sibiu
15491631,CAMSION SRL,4941,Transporturi rutiere de marfuri,Sibiu
15495650,S.C. REMARK GROUP S.R.L. Sibiu,4671,"Comert cu ridicata al combustibililor solizi, lichizi si gazosi al produselor derivate",Sibiu
15495668,ROMED SRL MEDIAS,6810,Cumpararea si vanzarea de bunuri imobiliare proprii,Sibiu
15507894,NOVA DISTRIB SRL,4321,Lucrari de instalatii electrice,Sibiu
15507932,NATY RO SRL,4711,"Comert cu amanuntul in magazine nespecializate, cu vanzare predominanta de produse alimentare, bauturi si tutun",Sibiu
15507940,BEAUTY CENTER SRL,4776,"Comert cu amanuntul al florilor, plantelor si semintelor, comert cu amanuntul al animalelor de companie si al hranei pentru acestea, in magazine specializate",Sibiu
15508008,DORIDAN SRL,4711,"Comert cu amanuntul in magazine nespecializate, cu vanzare predominanta de produse alimentare, bauturi si tutun",Sibiu
15508628,EU TRANS SRL,4941,Transporturi rutiere de marfuri,Sibiu
15508636,CORINA CONT SRL,6920,"Activitati de contabilitate si audit financiar, consultanta in domeniul fiscal",Sibiu
15513748,FLANDRA DESIGN SRL,4777,"Comert cu amanuntul al ceasurilor si bijuteriilor, in magazine specializate",Sibiu
15513799,VESTEMEAN COM SRL,6831,Agentii imobiliare,Sibiu
15527581,S.C. PRESTLAND  COMPANY S.R.L.,6831,Agentii imobiliare,Sibiu
15527590,SC  Vizonul  SRL,1420,Fabricarea articolelor din blana,Sibiu
15527603,SC BAC CONSTRUCT SRL,4399,Alte lucrari speciale de constructii n.c.a.,Sibiu
15527620,FRESH STYLE SRL,8559,Alte forme de invatamant n.c.a.,Sibiu
15533400,AGROLLINGEN S.R.L.,6820,Inchirierea si subinchirierea bunurilor imobiliare proprii sau inchiriate,Sibiu
15533443,MASTER CONSULT SRL,4120,Lucrari de constructii a cladirilor rezidentiale si nerezidentiale,Sibiu
15533478,AUGUSTA CONSULT SRL,121,Cultivarea strugurilor,Sibiu
15533540,MIRDANMED,4673,Comert cu ridicata al materialului lemnos si al materialelor de constructii si echipamentelor sanitare,Sibiu
15533583,LARSIV SRL,4641,Comert cu ridicata al produselor textile,Sibiu
15544485,S.C.ANN PREST SRL,7810,Activitati ale agentiilor de plasare a fortei de munca,Sibiu
15544507,S.C. TOTAL C V SOLUTIONS S.R.L.,2511,Fabricarea de constructii metalice si parti componente ale structurilor metalice,Sibiu
15544540,SC STEFANIA EXIMP SRL,4719,"Comert cu amanuntul in magazine nespecializate, cu vanzare predominanta de produse nealimentare",Sibiu
15544582,SC COFAMET INDUSTRIE SRL,2562,Operatiuni de mecanica generala,Sibiu
15544604,S.C GETA COM SRL.,2012,Fabricarea colorantilor si a pigmentilor,Sibiu
15544612,SC TRANS COMPLEX SRL,4532,Comert cu amanuntul de piese si accesorii pentru autovehicule,Sibiu
15546796,S.C. SOFTTECH S.R.L.,6209,Alte activitati de servicii privind tehnologia informatiei,Sibiu
15546826,ROXAL BLUE SRL,7490,"Alte activitati profesionale, stiintifice si tehnice n.c.a.",Sibiu
15552623,SIBART SRL,7311,Activitati ale agentiilor de publicitate,Sibiu
15552682,DULLY TRANS,111,"Cultivarea cerealelor (exclusiv orez), plantelor leguminoase si a plantelor producatoare de seminte oleaginoase",Sibiu
15552690,S.C. POIENITA SRL,4711,"Comert cu amanuntul in magazine nespecializate, cu vanzare predominanta de produse alimentare, bauturi si tutun",Sibiu
15559257,SISLEY STUDIO SRL,7490,"Alte activitati profesionale, stiintifice si tehnice n.c.a.",Sibiu
15562040,DUPLEX 2000 SRL,6820,Inchirierea si subinchirierea bunurilor imobiliare proprii sau inchiriate,Sibiu
15562120,CENTER CONSULTING SRL,6910,Activitati juridice,Sibiu
15562139,S.C.COSMINA IMPEX,4711,"Comert cu amanuntul in magazine nespecializate, cu vanzare predominanta de produse alimentare, bauturi si tutun",Sibiu
15564989,SC ETERNMARY SRL,4690,Comert cu ridicata nespecializat,Sibiu
15568760,SC ARENA SRL,9311,Activitati ale bazelor sportive,Sibiu
15570123,EUROTIMBER S.E. SRL,4673,Comert cu ridicata al materialului lemnos si al materialelor de constructii si echipamentelor sanitare,Sibiu
15571471,SC DEKA CONSTRUCT SRL,4120,Lucrari de constructii a cladirilor rezidentiale si nerezidentiale,Sibiu
15578836,CONTEO CONCEPT SRL,6920,"Activitati de contabilitate si audit financiar, consultanta in domeniul fiscal",Sibiu
15578909,SC SPIROMEDICA SRL,8622,Activitati de asistenta medicala specializata,Sibiu
15578941,CONT FOREST SRL,210,Silvicultura si alte activitati forestiere,Sibiu
15598981,SC SYSTECH SRL,7112,Activitati de inginerie si consultanta tehnica legate de acestea,Sibiu
15599014,TEMPO CONSULT SRL,7490,"Alte activitati profesionale, stiintifice si tehnice n.c.a.",Sibiu
15599120,AUDIT VERDE MARIA SRL,6920,"Activitati de contabilitate si audit financiar, consultanta in domeniul fiscal",Sibiu
15608759,METALART SRL,7022,Activitati de consultanta pentru afaceri si management,Sibiu
15619510,OLIMPIA SERVICII INTERNATIONALE SRL,7022,Activitati de consultanta pentru afaceri si management,Sibiu
15623210,SELA SCHELLENBERG SRL,4673,Comert cu ridicata al materialului lemnos si al materialelor de constructii si echipamentelor sanitare,Sibiu
15623252,S.C. MARKET  CONSULTING SRL,7022,Activitati de consultanta pentru afaceri si management,Sibiu
15623260,X-DENT SRL,8690,Alte activitati referitoare la sanatatea umana,Sibiu
15623309,PETRAPRESS SRL,5811,Activitati de editare a cartilor,Sibiu
15623392,SC MATCA IMPEX SRL,4322,"Lucrari de instalatii sanitare, de incalzire si de aer conditionat",Sibiu
15623406,VETECOM SERV SRL,4773,"Comert cu amanuntul al produselor farmaceutice, in magazine specializate",Sibiu
15623414,TRANS ROXANA SRL,4941,Transporturi rutiere de marfuri,Sibiu
15624983,BACHMANN ROMANIA  SRL,2712,Fabricarea aparatelor de control si distributie a electricitatii,Sibiu
