cif,company_name,caen_code,caen_description,county
33490928,SC ELISABETH FASHION MANAGEMENT SRL,4711,"Comert cu amanuntul in magazine nespecializate, cu vanzare predominanta de produse alimentare, bauturi si tutun",Sibiu
33494776,SC ROYAL EXTREME SRL- in insolventa,4631,Comert cu ridicata al fructelor si legumelor,Sibiu
33494792,Terra Sano S.R.L.,5621,Activitati de alimentatie (catering) pentru evenimente,Sibiu
33494806,S.C.MILICHRON SRL,6201,Activitati de realizare a soft-ului la comanda (software orientat client),Sibiu
33505050,S.C. GOLITECK MONTAJ S.R.L.,2511,Fabricarea de constructii metalice si parti componente ale structurilor metalice,Sibiu
33505093,EXPERT BUGETAR SRL,6201,Activitati de realizare a soft-ului la comanda (software orientat client),Sibiu
33509540,BICATER EXPERT SRL,6920,"Activitati de contabilitate si audit financiar, consultanta in domeniul fiscal",Sibiu
33518859,CARACTER CONSTRUCT SRL,7112,Activitati de inginerie si consultanta tehnica legate de acestea,Sibiu
33523669,EUROFAN SPEED SRL,4941,Transporturi rutiere de marfuri,Sibiu
33523740,S.C.CHEZ CLAUDDE S.R.L.,9604,Activitati de intretinere corporala,Sibiu
33523766,S.C. CHEZ ANNEMARIE S.R.L.,5510,Hoteluri si alte facilitati de cazare similare,Sibiu
33528852,OLA STORE SRL,4711,"Comert cu amanuntul in magazine nespecializate, cu vanzare predominanta de produse alimentare, bauturi si tutun",Sibiu
33528879,S.C. ECOSMART OFFICE S.R.L.,4120,Lucrari de constructii a cladirilor rezidentiale si nerezidentiale,Sibiu
33533077,RIMACO-AGROINTER S.R.L....,111,"Cultivarea cerealelor (exclusiv orez), plantelor leguminoase si a plantelor producatoare de seminte oleaginoase",Sibiu
33533131,SC BASUR TEX-MED SRL,4941,Transporturi rutiere de marfuri,Sibiu
33533190,AGIL SYS SRL,4652,Comert cu ridicata de componente si echipamente electronice si de telecomunicatii,Sibiu
33537508,SC A_A SELIMBAR AG.DE ASIGURARE SRL,6622,Activitati ale agentilor si broker-ilor de asigurari,Sibiu
33549227,EKIER SRL,5510,Hoteluri si alte facilitati de cazare similare,Sibiu
33551081,S.C. UBICUU JOY SRL,8559,Alte forme de invatamant n.c.a.,Sibiu
33555474,MERIDIAN AGENT DE ASIGURARE SEL,6622,Activitati ale agentilor si broker-ilor de asigurari,Sibiu
33555490,VASY GRUP RIO SRL,4120,Lucrari de constructii a cladirilor rezidentiale si nerezidentiale,Sibiu
33555504,S.C. TERMOCONTROL INSTAL SRL,4322,"Lucrari de instalatii sanitare, de incalzire si de aer conditionat",Sibiu
33560420,S.C. TRANSVLAD MEDIAS SRL,4932,Transporturi cu taxiuri,Sibiu
33560446,CARMANGERIA IMPERIAL SRL,5610,Restaurante,Sibiu
33564898,SC.CORINT HOTEL SRL,5610,Restaurante,Sibiu
33564936,S.C. CESSA MED SRL,8122,"Activitati specializate de curatenie a cladirilor, mijloacelor de transport, masini si utilaje industriale",Sibiu
33569968,BENROB CRB S.R.L,4779,Comert cu amanuntul al bunurilor de ocazie vandute prin magazine,Sibiu
33569976,YDU H&C TRANS SRL,5221,Activitati de servicii anexe pentru transporturi terestre,Sibiu
33570024,S.C.RUBELLE ART SRL,4622,Comert cu ridicata al florilor si al plantelor,Sibiu
33579910,CADASTRU VRABIE SRL,7112,Activitati de inginerie si consultanta tehnica legate de acestea,Sibiu
33579988,LA STAMPA RADYRI SRL,4941,Transporturi rutiere de marfuri,Sibiu
33584771,BAU BERATUNG UND HANDEL SRL,7112,Activitati de inginerie si consultanta tehnica legate de acestea,Sibiu
33584801,EVENIMENT PHARMA SRL,4773,"Comert cu amanuntul al produselor farmaceutice, in magazine specializate",Sibiu
33588986,RRR PLASTICA SRL,3832,Recuperarea materialelor reciclabile sortate,Sibiu
33589000,PROALIV SRL,7022,Activitati de consultanta pentru afaceri si management,Sibiu
33589060,SC POPASUL JUNILOR SRL,5590,Alte servicii de cazare,Sibiu
33594546,S.C. EXCLUSIVE EXPERT CONSULTING S.R.L.,8219,"Activitati de fotocopiere, de pregatire a documentelor si alte activitati specializate de secretariat",Sibiu
33594562,ESTEBAN STYLE SRL D,4791,Comert cu amanuntul prin intermediul caselor de comenzi sau prin Internet,Sibiu
33594570,Soc PELUGIO TRADE SRL,4619,Intermedieri in comertul cu produse diverse,Sibiu
33609680,INTERMEDALL,7022,Activitati de consultanta pentru afaceri si management,Sibiu
33626168,DIRECT CREDIT ASIG S.R.L.,6622,Activitati ale agentilor si broker-ilor de asigurari,Sibiu
33626249,SOFTR2.RO SRL,6201,Activitati de realizare a soft-ului la comanda (software orientat client),Sibiu
33636218,PIC SI POC TEAM SRL,4711,"Comert cu amanuntul in magazine nespecializate, cu vanzare predominanta de produse alimentare, bauturi si tutun",Sibiu
33636242,SC BRIANA SUN SRL,5520,Facilitati de cazare pentru vacante si perioade de scurta durata,Sibiu
33652094,BUSINESS FOUNDATION INDUSTRIES SRL,7022,Activitati de consultanta pentru afaceri si management,Sibiu
33652116,KENDRION INDUSTRIAL (SIBIU) SRL,2611,Fabricarea subansamblurilor electronice (module),Sibiu
33656444,EUROCONSULTING AUSTRIA SRL,7022,Activitati de consultanta pentru afaceri si management,Sibiu
33656460,SC FUTURE INFO DESIGN SRL,4719,"Comert cu amanuntul in magazine nespecializate, cu vanzare predominanta de produse nealimentare",Sibiu
33656525,SKATA DOT SRL,8292,Activitati de ambalare,Sibiu
33656592,ALTIUS MANAGEMENT SRL,7022,Activitati de consultanta pentru afaceri si management,Sibiu
33661564,WEST SPEED LOGISTIk SRL,4941,Transporturi rutiere de marfuri,Sibiu
33672440,KASANDRA & ANDREEA CONSTRUCT SRL,4120,Lucrari de constructii a cladirilor rezidentiale si nerezidentiale,Sibiu
33672474,SC AMINA EVENTS SRL,5621,Activitati de alimentatie (catering) pentru evenimente,Sibiu
33672504,DACOPAX SOLAR MEDIAS SRL,4520,Intretinerea si repararea autovehiculelor,Sibiu
33672520,SC BEATRICE EXPERTOUR SRL,7911,Activitati ale agentiilor turistice,Sibiu
33677617,NYK 63 SIB SRL,4711,"Comert cu amanuntul in magazine nespecializate, cu vanzare predominanta de produse alimentare, bauturi si tutun",Sibiu
33682362,S.C. SAFIR SIB PROIECT SRL,9200,Activitati de jocuri de noroc si pariuri,Sibiu
33682435,NELUTU COMPLECT SERV SRL,4520,Intretinerea si repararea autovehiculelor,Sibiu
33687041,S.C. ECONOMIC CONTAB SRL,6920,"Activitati de contabilitate si audit financiar, consultanta in domeniul fiscal",Sibiu
33687122,S.C. CAVINSOFT SRL,6201,Activitati de realizare a soft-ului la comanda (software orientat client),Sibiu
33691719,DR NATUR 14 S.R.L.-D,4791,Comert cu amanuntul prin intermediul caselor de comenzi sau prin Internet,Sibiu
33691751,PETA CREATIV SRL,1419,Fabricarea altor articole de imbracaminte si accesorii n.c.a.,Sibiu
33691786,HERMANNSTADT GOLDFIN SRL,6492,Alte activitati de creditare,Sibiu
33703058,A1 CONSTRUCT MANAGER SRL,7111,Activitati de arhitectura,Sibiu
33703090,ILYON TOURISM SRL-D,4711,"Comert cu amanuntul in magazine nespecializate, cu vanzare predominanta de produse alimentare, bauturi si tutun",Sibiu
33712439,SC MIRONIMOB SRL,6820,Inchirierea si subinchirierea bunurilor imobiliare proprii sau inchiriate,Sibiu
33712447,ALEMONIA SHOP SMART SRL,4791,Comert cu amanuntul prin intermediul caselor de comenzi sau prin Internet,Sibiu
33712455,ADYS TRUCK LOGISTICS SRL-D,4941,Transporturi rutiere de marfuri,Sibiu
33717819,S.C. ETA CHIC SRL,4771,"Comert cu amanuntul al imbracamintei, in magazine specializate",Sibiu
33717827,S.C. CALI TOTAL INVEST SRL,4752,"Comert cu amanuntul al articolelor de fierarie, al articolelor din sticla si a celor pentru vopsit, in magazine specializate",Sibiu
33717908,SCRIPTICS PROFESIONAL SERVICES SRL,6201,Activitati de realizare a soft-ului la comanda (software orientat client),Sibiu
33728311,ECOINSTAL TERM SRL,4752,"Comert cu amanuntul al articolelor de fierarie, al articolelor din sticla si a celor pentru vopsit, in magazine specializate",Sibiu
33733172,HERMANNSTADT OIL COMPANY SRL,8299,Alte activitati de servicii suport pentru intreprinderi n.c.a.,Sibiu
33733180,S.C. KUNST DEKOR SRL,4690,Comert cu ridicata nespecializat,Sibiu
33733202,VET-RX MEDICA SRL,4646,Comert cu ridicata al produselor farmaceutice,Sibiu
33737786,DNS ACOUSTICS S.R.L.,7739,"Activitati de inchiriere si leasing cu alte masini, echipamente si bunuri tangibile",Sibiu
33737816,S.C. ALDOR CENTRUM SRL,4614,"Intermedieri in comertul cu masini, echipamente industriale, nave si avioane",Sibiu
33737824,S.C. TAPAS BAND TAXI S.R.L.,4932,Transporturi cu taxiuri,Sibiu
33742677,LEX CAR MOTORS SRL,4941,Transporturi rutiere de marfuri,Sibiu
33742693,S.C. JOHANN TRAVEL SRL,4939,Alte transporturi terestre de calatori n.c.a,Sibiu
33742715,PAVICON INVEST SRL,4120,Lucrari de constructii a cladirilor rezidentiale si nerezidentiale,Sibiu
33747968,ROGVAIV IT TECHNOLOGY SRL,9511,Repararea calculatoarelor si a echipamentelor periferice,Sibiu
33757848,MADACONS FLORINA SRL,5630,Baruri si alte activitati de servire a bauturilor,Sibiu
33757856,MERIDIAN INTERKONTAKT SRL,7810,Activitati ale agentiilor de plasare a fortei de munca,Sibiu
33757864,SC  HERMANSTADT HAUSMEISTER  SRL,9521,"Repararea aparatelor electrocasnice, de uz casnic",Sibiu
33757872,S.C.MEX ADVERTISING-S.R.L.,7311,Activitati ale agentiilor de publicitate,Sibiu
33772724,S.C. SERB RALSILV MED SRL,4711,"Comert cu amanuntul in magazine nespecializate, cu vanzare predominanta de produse alimentare, bauturi si tutun",Sibiu
33777705,GDI SERVICII SRL,4321,Lucrari de instalatii electrice,Sibiu
33777756,ANDREEA  SI ROBERT SHOP SRL,4711,"Comert cu amanuntul in magazine nespecializate, cu vanzare predominanta de produse alimentare, bauturi si tutun",Sibiu
33782671,GREEN TRANSILVANIA INCENTIVE SRL,7990,Alte servicii de rezervare si asistenta turistica,Sibiu
33782680,SC RSK DEVELOPMENT SRL,5224,Manipulari,Sibiu
33782779,EUROACTIV EVENTS SRL,6820,Inchirierea si subinchirierea bunurilor imobiliare proprii sau inchiriate,Sibiu
33782787,ANDREAS SPIDI TRANS SRL,4941,Transporturi rutiere de marfuri,Sibiu
33787075,PAUL BUILDING SRL,4120,Lucrari de constructii a cladirilor rezidentiale si nerezidentiale,Sibiu
33791475,2B SMART PROM S.R.L.,7220,Cercetare- dezvoltare in stiinte sociale si umaniste,Sibiu
33797125,SC PRO EXPERT SERVICE HEATPIPE SRL,4778,"Comert cu amanuntul al altor bunuri noi, in magazine specializate",Sibiu
33802302,SC STAY CLEAN SRL,8122,"Activitati specializate de curatenie a cladirilor, mijloacelor de transport, masini si utilaje industriale",Sibiu
33811815,SC EU SWESPEDITION SRL,4941,Transporturi rutiere de marfuri,Sibiu
33811831,CONDREA PLUS SRL,4939,Alte transporturi terestre de calatori n.c.a,Sibiu
33816570,SC TOPO EXPERT STUDIO A&amp;amp;amp;amp;amp;S SRL,7112,Activitati de inginerie si consultanta tehnica legate de acestea,Sibiu
33821622,SC DAN MEAT EXPERT SRL,4618,"Intermedieri in comertul specializat in vanzarea produselor cu caracter specific, n.c.a.",Sibiu
33821649,BIOVERA NATURAL,4645,Comert cu ridicata al produselor cosmetice si de parfumerie,Sibiu
33827145,S.C. NOVA LAB SYSTEM S.R.L.,6820,Inchirierea si subinchirierea bunurilor imobiliare proprii sau inchiriate,Sibiu
33836720,S.C. URBAN PRO DESIGN S.R.L.,7112,Activitati de inginerie si consultanta tehnica legate de acestea,Sibiu
33836747,SC AMORE PER BIMBI SRL,4616,"Intermedieri in comertul cu textile, confectii din blana , incaltaminte si articole din piele",Sibiu
33841336,GIFT ART SRL,4776,"Comert cu amanuntul al florilor, plantelor si semintelor, comert cu amanuntul al animalelor de companie si al hranei pentru acestea, in magazine specializate",Sibiu
33841409,CONTACT SPORT SRL,9311,Activitati ale bazelor sportive,Sibiu
33846503,S&T SIBASIG ASISTENT DE BROKERAJ SRL,6622,Activitati ale agentilor si broker-ilor de asigurari,Sibiu
33846562,GG HOUSE INVEST SRL,4120,Lucrari de constructii a cladirilor rezidentiale si nerezidentiale,Sibiu
33846570,CARGO DEPOT RND,4941,Transporturi rutiere de marfuri,Sibiu
33851623,MIRAND CATERING SRL,5610,Restaurante,Sibiu
33851658,DEPOSIB EXPERT SRL,4673,Comert cu ridicata al materialului lemnos si al materialelor de constructii si echipamentelor sanitare,Sibiu
33851666,LAERTIUS CAPITAL MANAGEMENT SRL,6810,Cumpararea si vanzarea de bunuri imobiliare proprii,Sibiu
33851682,POLYCONTACT HERMANNSTADT SRL,2931,Fabricarea de echipamente electrice si electronice pentru autovehicule si pentru motoare de autovehicule,Sibiu
33851690,PETRODEN INVEST SRL,4671,"Comert cu ridicata al combustibililor solizi, lichizi si gazosi al produselor derivate",Sibiu
33861309,L.S.WILD BERRY S.R.L.,125,"Cultivarea arbustilor fructiferi, capsunilor, nuciferilor si a altor pomi fructiferi",Sibiu
33870811,MIKOS PLUS S.R.L.,4941,Transporturi rutiere de marfuri,Sibiu
33875304,S.C. TERRALOG IND SRL,2932,Fabricarea altor piese si accesorii pentru autovehicule si pentru motoare de autovehicule,Sibiu
33875312,PAVIO BUILDING SRL,4120,Lucrari de constructii a cladirilor rezidentiale si nerezidentiale,Sibiu
33875347,SC MAXITUDE SRL,6202,Activitati de consultanta in tehnologia informatiei,Sibiu
33879594,S.C. BAVARIA FOREST INVEST S.R.L.,210,Silvicultura si alte activitati forestiere,Sibiu
33883897,ALEXANDRA & MIRCEA WELLNESS S.R.L.,9604,Activitati de intretinere corporala,Sibiu
33883927,LCB EXPERT ACCOUNTING SRL,6920,"Activitati de contabilitate si audit financiar, consultanta in domeniul fiscal",Sibiu
33888380,SC PANEURO TRAVEL SRL,7911,Activitati ale agentiilor turistice,Sibiu
33888460,SC KUX ACTUALITY SRL,4941,Transporturi rutiere de marfuri,Sibiu
33893327,KAPTAN RESTAURANT SRL,5610,Restaurante,Sibiu
33898219,SC CARTAGA RISK ASSIST SRL,6622,Activitati ale agentilor si broker-ilor de asigurari,Sibiu
33901420,INCOME PRODUCTION SRL,5630,Baruri si alte activitati de servire a bauturilor,Sibiu
33906133,SC ZEDY CLEAN DDD SRL,8122,"Activitati specializate de curatenie a cladirilor, mijloacelor de transport, masini si utilaje industriale",Sibiu
33906206,CAB. MED. DR. BOTEZAN CRISTINA SRL,8621,Activitati de asistenta medicala generala,Sibiu
33911253,GINEKO PRO MEDICAL SRL,8622,Activitati de asistenta medicala specializata,Sibiu
33911261,SC SPRING CONF SRL,1413,Fabricarea altor articole de imbracaminte (exclusiv lenjeria de corp),Sibiu
33911288,ASDS TAXFINANCE SRL,6920,"Activitati de contabilitate si audit financiar, consultanta in domeniul fiscal",Sibiu
33911326,S.C. WALKOS INDUSTRIES S.R.L,4674,Comert cu ridicata al echipamentelor si furniturilor de fierarie pentru instalatii sanitare si de incalzire,Sibiu
33911334,ARHITECTI PASCA & BORDEAN SRL,7111,Activitati de arhitectura,Sibiu
33916471,S.C. IMOB CASA TA SRL,6831,Agentii imobiliare,Sibiu
33916480,ROSU SI NEGRU CIBIN SRL,5630,Baruri si alte activitati de servire a bauturilor,Sibiu
33920855,J2 EVOLUTION SRL,4110,Dezvoltare (promovare) imobiliara,Sibiu
33920880,Societatea JIFA IMOBILIARE SRL,6820,Inchirierea si subinchirierea bunurilor imobiliare proprii sau inchiriate,Sibiu
33920898,IZOLATII STABIL CONSTRUCT SRL,4120,Lucrari de constructii a cladirilor rezidentiale si nerezidentiale,Sibiu
33920979,Societatea JIFA LOGISTIC SRL,3812,Colectarea deseurilor periculoase,Sibiu
33925640,SC PERFECT CLEAN ENERGY SRL,8211,Activitati combinate de secretariat,Sibiu
33925682,S.C.KARPATEN MEAT SIEBENBUERGEN SRL,142,Cresterea altor bovine,Sibiu
33925690,SC ALLBIZZ ELECTRIC SRL,4321,Lucrari de instalatii electrice,Sibiu
33929684,SC FABIO M. CONSTRUCTION SRL,4120,Lucrari de constructii a cladirilor rezidentiale si nerezidentiale,Sibiu
33929692,SHOWLIGHT SRL,9002,Activitati suport pentru interpretare artistica (spectacole),Sibiu
33929714,DAMAR T.M.D. 63 SRL,4941,Transporturi rutiere de marfuri,Sibiu
33929765,DARCHIM FITO S.R.L.,4778,"Comert cu amanuntul al altor bunuri noi, in magazine specializate",Sibiu
33929773,ALPHA FIT SRL,4642,Comert cu ridicata al imbracamintei si incaltamintei,Sibiu
33929781,S.C. PAPA MITCH SRL,1013,Fabricarea produselor din carne (inclusiv din carne de pasare),Sibiu
33933448,VALLETTA RESIDENCE SRL,4110,Dezvoltare (promovare) imobiliara,Sibiu
33933456,MB CARN SIB SRL,1011,Productia si conservarea carnii,Sibiu
33933502,S.C. SMART GSM WORLD SRL,4742,Comert cu amanuntul al echipamentului pentru telecomunicatii in magazine specializate,Sibiu
33935562,"S.C. OPENMINDED SOLUTIONS- THINK,MAKE,GROW SRL",6201,Activitati de realizare a soft-ului la comanda (software orientat client),Sibiu
33935570,S.C. AGROLAND NATURA S.R.L.,129,Cultivarea altor plante permanente,Sibiu
33941955,COMPLEX TURISTIC CHEILE CIBINULUI,5520,Facilitati de cazare pentru vacante si perioade de scurta durata,Sibiu
33941980,WOLF BEST ESTATE SRL,4110,Dezvoltare (promovare) imobiliara,Sibiu
33951029,ARYAN TOTAL SRL,4120,Lucrari de constructii a cladirilor rezidentiale si nerezidentiale,Sibiu
33955594,AIT TRANSLATIONS & SERVICES SRL,7430,Activitati de traducere scrisa si orala (interpreti),Sibiu
33955632,SC RRR 30 IMPEX SRL,5630,Baruri si alte activitati de servire a bauturilor,Sibiu
33955640,SC ENDER IMOB SRL,7820,"Activitati de contractare, pe baze temporare, a personalului",Sibiu
33960132,JOHN FRUITS SRL,4721,"Comert cu amanuntul al fructelor si legumelor proaspete, in magazine specializate",Sibiu
33960183,SC DELISIG ASISTENT IN BROKERAJ SRL,6622,Activitati ale agentilor si broker-ilor de asigurari,Sibiu
33960205,S.C.SYTECH AUTOMATION SERVICE SRL,3314,Repararea echipamentelor electrice,Sibiu
33964550,LA JINARU SIBIANU COMERT SRL,4711,"Comert cu amanuntul in magazine nespecializate, cu vanzare predominanta de produse alimentare, bauturi si tutun",Sibiu
33965385,LIA&amp;GEANI SRL,4711,"Comert cu amanuntul in magazine nespecializate, cu vanzare predominanta de produse alimentare, bauturi si tutun",Sibiu
33965407,AGROSIB MAST SRL,125,"Cultivarea arbustilor fructiferi, capsunilor, nuciferilor si a altor pomi fructiferi",Sibiu
33971026,FAST FORWARD LOGISTICS SRL,4941,Transporturi rutiere de marfuri,Sibiu
33977347,CRILEX TOURS,1071,"Fabricarea painii, fabricarea prajiturilor si a produselor proaspete de patiserie",Sibiu
33977380,METALIC FAN S.R.L.,2511,Fabricarea de constructii metalice si parti componente ale structurilor metalice,Sibiu
33982742,VMCE International Imob,4941,Transporturi rutiere de marfuri,Sibiu
34000420,SC GYM TONIC SRL,9313,Activitati ale centrelor de fitness,Sibiu
34000439,AIR SCENT SRL,4791,Comert cu amanuntul prin intermediul caselor de comenzi sau prin Internet,Sibiu
34000455,SC ADI SPEED CARGO SRL,4941,Transporturi rutiere de marfuri,Sibiu
34006385,WEINNER INVEST SRL,4941,Transporturi rutiere de marfuri,Sibiu
34018436,S.C.ANASIB INVEST SRL,4677,Comert cu ridicata al deseurilor si resturilor,Sibiu
34024373,ENERGO SMART INVEST,3513,Distributia energiei electrice,Sibiu
34024381,S.C. DOMENIILE VITICOLE APOLD SRL,121,Cultivarea strugurilor,Sibiu
34024403,SC LOEBLICH SRL,6810,Cumpararea si vanzarea de bunuri imobiliare proprii,Sibiu
34024411,S.C. ALLTECH SOLUTIONS SRL,4322,"Lucrari de instalatii sanitare, de incalzire si de aer conditionat",Sibiu
34031141,S.C.SIB ACCOUNTING SRL,6920,"Activitati de contabilitate si audit financiar, consultanta in domeniul fiscal",Sibiu
34031214,SAG SPEDITION S.R.L.,4941,Transporturi rutiere de marfuri,Sibiu
34037683,EXCENTRIC HAIR SRL,9602,Coafura si alte activitati de infrumusetare,Sibiu
34037705,S.C. RESTAURANT DOBSI SRL,5610,Restaurante,Sibiu
34044109,GIURGIU BUILD SRL,4120,Lucrari de constructii a cladirilor rezidentiale si nerezidentiale,Sibiu
34044117,S.C. KRYS TAX RAPID SRL,4932,Transporturi cu taxiuri,Sibiu
34049734,SC MAGAZIA BCS PLANT SRL,8130,Activitati de intretinere peisagistica,Sibiu
34061630,S.C.FUTURE EVENTS TRANSYLVANIA SRL,9001,Activitati de interpretare artistica (spectacole),Sibiu
34061649,NORBY LOGISTICS SRL,4932,Transporturi cu taxiuri,Sibiu
34061657,MAP PROMPT DISTRIBUTION SRL,4941,Transporturi rutiere de marfuri,Sibiu
34061703,EMBYTE SRL,6201,Activitati de realizare a soft-ului la comanda (software orientat client),Sibiu
34068418,PENTRU BEBEI SRL,4791,Comert cu amanuntul prin intermediul caselor de comenzi sau prin Internet,Sibiu
34074703,SC MULTY SISTEM NETWORK SRL,6311,"Prelucrarea datelor, administrarea paginilor web si activitati conexe",Sibiu
34074720,SC ALANI BOTANICS SRL D,4776,"Comert cu amanuntul al florilor, plantelor si semintelor, comert cu amanuntul al animalelor de companie si al hranei pentru acestea, in magazine specializate",Sibiu
34086880,PAOLO DEZMEMBRARI SRL,4520,Intretinerea si repararea autovehiculelor,Sibiu
34086902,SC DIACOM TOTAL SRL,4711,"Comert cu amanuntul in magazine nespecializate, cu vanzare predominanta de produse alimentare, bauturi si tutun",Sibiu
34086945,WOOLTEXT 2000 SRL,4641,Comert cu ridicata al produselor textile,Sibiu
34099317,S.C. EVELYNE FRUCT SRL,4631,Comert cu ridicata al fructelor si legumelor,Sibiu
34105168,TANASESCU CONSTRUCT SRL,4120,Lucrari de constructii a cladirilor rezidentiale si nerezidentiale,Sibiu
34105176,SMARTECH  INSTAL  SRL,4321,Lucrari de instalatii electrice,Sibiu
34105192,EGO TRANSPORT SRL,4941,Transporturi rutiere de marfuri,Sibiu
34105214,S.C.DOMIR SIB SRL,5610,Restaurante,Sibiu
34105249,SC MAN SPEED SRL,4399,Alte lucrari speciale de constructii n.c.a.,Sibiu
34111445,S.C. DANIAN ALI TAXI S.R.L.,4932,Transporturi cu taxiuri,Sibiu
34111496,CORECT LONDON CONSTRUCT SRL,4120,Lucrari de constructii a cladirilor rezidentiale si nerezidentiale,Sibiu
34111950,KRASSCOM TRADING S.R.L.,4791,Comert cu amanuntul prin intermediul caselor de comenzi sau prin Internet,Sibiu
34117502,VLADUVET SRL,7500,Activitati veterinare,Sibiu
34117510,ENCORE EVENTS S.R.L.,8230,"Activitati de organizare a expozitiilor, targurilor si congreselor",Sibiu
34117570,MPS CARMPROD SRL,4941,Transporturi rutiere de marfuri,Sibiu
34117588,CIC CORPORATE INSURANCECIC CORPORATE INSURANCE,6622,Activitati ale agentilor si broker-ilor de asigurari,Sibiu
34123938,FASHION LOVE CONCEPT SRL,4791,Comert cu amanuntul prin intermediul caselor de comenzi sau prin Internet,Sibiu
34123954,CLINICA DR. LUPU-PETRIA SRL,8622,Activitati de asistenta medicala specializata,Sibiu
34123962,DADDY MAGIC DESIGN SRL,4120,Lucrari de constructii a cladirilor rezidentiale si nerezidentiale,Sibiu
34123970,S.C. PAV LANDWITTSCHAFT SRL,7810,Activitati ale agentiilor de plasare a fortei de munca,Sibiu
34123989,DA VINCI RESIDENCE SRL,5520,Facilitati de cazare pentru vacante si perioade de scurta durata,Sibiu
34130838,S.C. FAUST CAFE S.R.L.,5630,Baruri si alte activitati de servire a bauturilor,Sibiu
34130854,DASCOROM SHOP,4690,Comert cu ridicata nespecializat,Sibiu
34130897,AGENTTOUR SRL,6622,Activitati ale agentilor si broker-ilor de asigurari,Sibiu
34136954,NET ENGINEERING RO SRL,7112,Activitati de inginerie si consultanta tehnica legate de acestea,Sibiu
34136962,MASTER CHEMICALS SRL,4675,Comert cu ridicata al produselor chimice,Sibiu
34143307,LEGIS SUPORT,6209,Alte activitati de servicii privind tehnologia informatiei,Sibiu
34143340,S.C. CHEZ ANNEMARIE BISTRO SRL,5610,Restaurante,Sibiu
34143366,SC VLC DIVISION SRL,4791,Comert cu amanuntul prin intermediul caselor de comenzi sau prin Internet,Sibiu
34149458,SICO TOTAL SRL,4673,Comert cu ridicata al materialului lemnos si al materialelor de constructii si echipamentelor sanitare,Sibiu
34149466,GRAMINA AUDICONT MED SRL,6920,"Activitati de contabilitate si audit financiar, consultanta in domeniul fiscal",Sibiu
34149504,S.C. D & D MARKET INVEST SRL,4711,"Comert cu amanuntul in magazine nespecializate, cu vanzare predominanta de produse alimentare, bauturi si tutun",Sibiu
34149520,SC DST LOGISTIC SRL,4941,Transporturi rutiere de marfuri,Sibiu
34155778,MAGNOLIA NEV GARDEN SRL,8130,Activitati de intretinere peisagistica,Sibiu
34155875,EXPERIENCE TRANSYLVANIA GUESTHOUSES SRL,5510,Hoteluri si alte facilitati de cazare similare,Sibiu
34155883,HRM INTERTRANS SRL,4941,Transporturi rutiere de marfuri,Sibiu
34155913,MAROLY EUROTRANS S.R.L.,4941,Transporturi rutiere de marfuri,Sibiu
34162392,TRIFORELI SRL,7112,Activitati de inginerie si consultanta tehnica legate de acestea,Sibiu
34169013,VILA SIBIU SRL,5520,Facilitati de cazare pentru vacante si perioade de scurta durata,Sibiu
34175554,SC DENTAL STUDIO SIBIU SRL,8623,Activitati de asistenta stomatologica,Sibiu
34188600,SC BGB SERVICES SRL,5610,Restaurante,Sibiu
34188635,SC AL-KO VEHICLE COMPONENTS  ROMANIA  SRL,2932,Fabricarea altor piese si accesorii pentru autovehicule si pentru motoare de autovehicule,Sibiu
34194602,SOMNIUM SRL,9609,Alte activitati de servicii n.c.a.,Sibiu
34194610,Roman Spedition SRL,4941,Transporturi rutiere de marfuri,Sibiu
34200224,NOAH MEDICAL,4646,Comert cu ridicata al produselor farmaceutice,Sibiu
34200763,LAURTIL SRL,4711,"Comert cu amanuntul in magazine nespecializate, cu vanzare predominanta de produse alimentare, bauturi si tutun",Sibiu
34200810,BALIO RETAIL S.R.L.,4711,"Comert cu amanuntul in magazine nespecializate, cu vanzare predominanta de produse alimentare, bauturi si tutun",Sibiu
34213542,S.C. ALCA SIB CONSTRUCT S.R.L.,4120,Lucrari de constructii a cladirilor rezidentiale si nerezidentiale,Sibiu
34213577,SC AIGNER MG AGRO SRL,111,"Cultivarea cerealelor (exclusiv orez), plantelor leguminoase si a plantelor producatoare de seminte oleaginoase",Sibiu
34219740,S.C. ORA DOUA SRL,4771,"Comert cu amanuntul al imbracamintei, in magazine specializate",Sibiu
34219758,BAVARIA PROJECT MANAGEMENT CONSULTING SRL,6831,Agentii imobiliare,Sibiu
34219782,SC ELIT CONT OFFICE SRL,6920,"Activitati de contabilitate si audit financiar, consultanta in domeniul fiscal",Sibiu
34219790,ARABESQUE ROYAL EXPRESS SRL,4120,Lucrari de constructii a cladirilor rezidentiale si nerezidentiale,Sibiu
34227041,MAT SALES SRL,4618,"Intermedieri in comertul specializat in vanzarea produselor cu caracter specific, n.c.a.",Sibiu
34227092,SC FINCLUSION SYSTEMS SRL,6201,Activitati de realizare a soft-ului la comanda (software orientat client),Sibiu
34232153,Marcons Plus S.R.L.,4120,Lucrari de constructii a cladirilor rezidentiale si nerezidentiale,Sibiu
34232196,ANNE CONCEPT SRL,6622,Activitati ale agentilor si broker-ilor de asigurari,Sibiu
34232250,S.C. KOKIRKA INVEST SRL,6622,Activitati ale agentilor si broker-ilor de asigurari,Sibiu
34238016,BACK UP CARGO SRL,4941,Transporturi rutiere de marfuri,Sibiu
34238032,KUKLA STYLE SRL-D,4771,"Comert cu amanuntul al imbracamintei, in magazine specializate",Sibiu
