cif,company_name,caen_code,caen_description,county
22810210,TACOM MED SRL,4332,Lucrari de tamplarie si dulgherie,Sibiu
22810237,COSTI TRANSIB SRL,4941,Transporturi rutiere de marfuri,Sibiu
22818893,S.C.GREEN LAND SRL,6810,Cumpararea si vanzarea de bunuri imobiliare proprii,Sibiu
22818907,CASA SPATAR SRL,5590,Alte servicii de cazare,Sibiu
22818915,CASI - ANA SRL,4711,"Comert cu amanuntul in magazine nespecializate, cu vanzare predominanta de produse alimentare, bauturi si tutun",Sibiu
22825114,STUDIO DESIGN SRL,7111,Activitati de arhitectura,Sibiu
22825130,W.G.M. SRL,8299,Alte activitati de servicii suport pentru intreprinderi n.c.a.,Sibiu
22825238,SOFIA CONTABILITATE SRL,6920,"Activitati de contabilitate si audit financiar, consultanta in domeniul fiscal",Sibiu
22825246,VLADILI SRL,5520,Facilitati de cazare pentru vacante si perioade de scurta durata,Sibiu
22842964,SC IN tIME Direkt-Kuriere SRL,5320,Alte activitati postale si de curier,Sibiu
22846036,S.C. MPA S.R.L.,6820,Inchirierea si subinchirierea bunurilor imobiliare proprii sau inchiriate,Sibiu
22851970,S.C. SMART TECH S.R.L.,4321,Lucrari de instalatii electrice,Sibiu
22851989,CBN INTERMED SRL,4643,"Comert cu ridicata al aparatelor electrice de uz gospodaresc, al aparatelor de radio si televizoarelor",Sibiu
22852003,CANAIA SRL,5520,Facilitati de cazare pentru vacante si perioade de scurta durata,Sibiu
22861010,S.C. PRINT ATU S.R.L.,1812,Alte activitati de tiparire n.c.a.,Sibiu
22864253,SC ORIZONT EXPRES,142,Cresterea altor bovine,Sibiu
22864296,SC VASCONI GRUP SRL,1052,Fabricarea inghetatei,Sibiu
22864318,SC TOD MAC SRL,4939,Alte transporturi terestre de calatori n.c.a,Sibiu
22864385,SC STROIA INSTAL SRL,4221,Lucrari de constructii a proiectelor utilitare pentru fluide,Sibiu
22896468,AMI INTERMED SRL,7810,Activitati ale agentiilor de plasare a fortei de munca,Sibiu
22896476,ORHIDEEA IMOBILIARE SRL,6831,Agentii imobiliare,Sibiu
22896590,LAUCAS SRL,4311,Lucrari de demolare a constructiilor,Sibiu
22896646,TERRA GRUP SRL,7711,Activitati de inchiriere si leasing cu autoturisme si autovehicule rutiere usoare,Sibiu
22908384,SC HODECOL S.R.L.,6810,Cumpararea si vanzarea de bunuri imobiliare proprii,Sibiu
22935303,S.C. PDA TIM CON SRL,4299,Lucrari de constructii a altor proiecte ingineresti n.c.a,Sibiu
22935311,PHOENIX RECICLYNG SRL,3832,Recuperarea materialelor reciclabile sortate,Sibiu
22941933,SARAH LOGISTIC SRL,4941,Transporturi rutiere de marfuri,Sibiu
22941950,HERPROD S.R.L.,1396,Fabricarea de articole tehnice si industriale din textile,Sibiu
22942009,MMR IDEAS SRL,150,Activitati in ferme mixte (cultura vegetala combinata cu cresterea animalelor),Sibiu
22946116,GRUPO ANTOLIN SIBIU SRL,2740,Fabricarea de echipamente electrice de iluminat,Sibiu
22949856,SC DAR-SIB 2007 SRL,4120,Lucrari de constructii a cladirilor rezidentiale si nerezidentiale,Sibiu
22972115,PRIME TIME CONSULTING,7022,Activitati de consultanta pentru afaceri si management,Sibiu
22972123,SC ALBIS PLASTIC SRL,4676,Comert cu ridicata al altor produse intermediare,Sibiu
22980290,OFFICE CONT SRL,6920,"Activitati de contabilitate si audit financiar, consultanta in domeniul fiscal",Sibiu
22986498,SC EVOLUTIV SRL,5811,Activitati de editare a cartilor,Sibiu
22986501,PLANET  POWER  SRL,9604,Activitati de intretinere corporala,Sibiu
22986560,LOGISTREAM INTERNATIONAL SRL,4941,Transporturi rutiere de marfuri,Sibiu
22986609,ANNA MARIA CONSULTING SRL,8621,Activitati de asistenta medicala generala,Sibiu
22986617,S.C. 3W PROMOTER SRL,6311,"Prelucrarea datelor, administrarea paginilor web si activitati conexe",Sibiu
22986641,BENNO TRANSPORT,4941,Transporturi rutiere de marfuri,Sibiu
23013646,SOTEC SOFTWARE SRL,6201,Activitati de realizare a soft-ului la comanda (software orientat client),Sibiu
23022890,CEMBRA SRL,210,Silvicultura si alte activitati forestiere,Sibiu
23028639,SC AG-BROKER DE ASIGURARE SRL,6622,Activitati ale agentilor si broker-ilor de asigurari,Sibiu
23028647,AG CREDIT SRL,6619,"Activitati auxiliare intermedierilor financiare, exclusiv activitati de asigurari sifonduri de pensii",Sibiu
23038489,ZACARIA DEVELOPMENTS SRL,4110,Dezvoltare (promovare) imobiliara,Sibiu
23038535,BRODANTE SRL,1413,Fabricarea altor articole de imbracaminte (exclusiv lenjeria de corp),Sibiu
23038551,G  &  G  DISTRIBUTION,4673,Comert cu ridicata al materialului lemnos si al materialelor de constructii si echipamentelor sanitare,Sibiu
23047878,OVOSIB FARMS SRL,147,Cresterea pasarilor,Sibiu
23047886,PLANAGRO SRL,3320,Instalarea masinilor si echipamentelor industriale,Sibiu
23047959,SC GEOING SRL,7112,Activitati de inginerie si consultanta tehnica legate de acestea,Sibiu
23049968,CIBINIUM SAS,4540,"Comert cu motociclete, piese si accesorii aferente, intretinerea si repararea motocicletelor",Sibiu
23050067,SC ROMWIL TRADING SRL,4663,Comert cu ridicata al masinilor pentru industria miniera si constructii,Sibiu
23058320,SOCIETATEA VIROLA-INDEPENDENTA S.A.,6820,Inchirierea si subinchirierea bunurilor imobiliare proprii sau inchiriate,Sibiu
23058338,CASA ALBA -INDEPENDENTA SA,6820,Inchirierea si subinchirierea bunurilor imobiliare proprii sau inchiriate,Sibiu
23071868,S.C.FAST MOBILIS S.R.L.,4942,Servicii de mutare,Sibiu
23071884,S.C. TEODORA TRANS S.R.L.,4941,Transporturi rutiere de marfuri,Sibiu
23081667,ISAIA TRADING,4771,"Comert cu amanuntul al imbracamintei, in magazine specializate",Sibiu
23081675,SC GMC LOGISTIK SRL,4941,Transporturi rutiere de marfuri,Sibiu
23081691,SINAPSIS SRL,6201,Activitati de realizare a soft-ului la comanda (software orientat client),Sibiu
23081705,S.C. NOLEGGIO S.R.L.,5621,Activitati de alimentatie (catering) pentru evenimente,Sibiu
23081721,EUROPARTENER CONSTRUCT SRL,4120,Lucrari de constructii a cladirilor rezidentiale si nerezidentiale,Sibiu
23090258,BISS CONSULT SRL,7490,"Alte activitati profesionale, stiintifice si tehnice n.c.a.",Sibiu
23090274,TC DEVELOPMENT SRL,4120,Lucrari de constructii a cladirilor rezidentiale si nerezidentiale,Sibiu
23090312,SC BHAIRAVIA SRL,6831,Agentii imobiliare,Sibiu
23098197,PRO ZIP SRL,4719,"Comert cu amanuntul in magazine nespecializate, cu vanzare predominanta de produse nealimentare",Sibiu
23098200,NICORA SRL,7732,Activitati de inchiriere si leasing cu masini si echipamente pentru constructii,Sibiu
23106737,SANA POWER SRL,5590,Alte servicii de cazare,Sibiu
23106753,S.C. ETA CONSTRUCT AMENAJARI INTERIOARE SRL,4120,Lucrari de constructii a cladirilor rezidentiale si nerezidentiale,Sibiu
23124938,RIDERS POINT S.R.L.,4540,"Comert cu motociclete, piese si accesorii aferente, intretinerea si repararea motocicletelor",Sibiu
23124954,SC MEDCONSTRUCT SRL,4333,Lucrari de pardosire si placare a peretilor,Sibiu
23132574,GVS SIBIU SRL,6810,Cumpararea si vanzarea de bunuri imobiliare proprii,Sibiu
23132710,SC MEGA MOB SRL,3101,Fabricarea de mobila pentru birouri si magazine,Sibiu
23132779,TOTAL BANCIU S.R.L.,4941,Transporturi rutiere de marfuri,Sibiu
23140640,ESTIMAR SRL,6831,Agentii imobiliare,Sibiu
23140666,"SC. ""DIASIB"" S.R.L.",4520,Intretinerea si repararea autovehiculelor,Sibiu
23152784,EDILRENT SRL,4644,"Comert cu ridicata al produselor din ceramica, sticlarie, si produse de intretinere",Sibiu
23152849,F & M SERVICE SRL,7120,Activitati de testare si analize tehnice,Sibiu
23165148,SC DARA IMOB SRL,8130,Activitati de intretinere peisagistica,Sibiu
23165180,S.C. EUROMETAL SIB SRL,4619,Intermedieri in comertul cu produse diverse,Sibiu
23165229,SC PERFORMER SRL,8553,Scoli de conducere (pilotaj),Sibiu
23165245,EMY & TAVY,4120,Lucrari de constructii a cladirilor rezidentiale si nerezidentiale,Sibiu
23165253,RSB INMO INVESTMENT SRL,4110,Dezvoltare (promovare) imobiliara,Sibiu
23165270,S.C. TRANSNIC SRL,4711,"Comert cu amanuntul in magazine nespecializate, cu vanzare predominanta de produse alimentare, bauturi si tutun",Sibiu
23175141,S.C. MARIO & NICOLE SRL,4532,Comert cu amanuntul de piese si accesorii pentru autovehicule,Sibiu
23182440,TAKO INVEST SRL,6820,Inchirierea si subinchirierea bunurilor imobiliare proprii sau inchiriate,Sibiu
23182505,SC  ROMPALET 24  SRL,1624,Fabricarea ambalajelor din lemn,Sibiu
23207901,SC NICOLAS SRL,5610,Restaurante,Sibiu
23207987,BNL SRL,4941,Transporturi rutiere de marfuri,Sibiu
23208036,EVICON SOFT S.R.L.,6920,"Activitati de contabilitate si audit financiar, consultanta in domeniul fiscal",Sibiu
23208060,GATA-GATA SRL,6810,Cumpararea si vanzarea de bunuri imobiliare proprii,Sibiu
23218919,SC COMPASS POOL & SPA SRL,4619,Intermedieri in comertul cu produse diverse,Sibiu
23221302,MEDICINA MUNCII S.R.L.,8622,Activitati de asistenta medicala specializata,Sibiu
23221353,S.C. GEORGIANA TRANS S.R.L.,4932,Transporturi cu taxiuri,Sibiu
23221361,S.C. JOJO S.R.L.,4120,Lucrari de constructii a cladirilor rezidentiale si nerezidentiale,Sibiu
23221418,RALEX TRADING S.R.L.,4711,"Comert cu amanuntul in magazine nespecializate, cu vanzare predominanta de produse alimentare, bauturi si tutun",Sibiu
23235316,ISB SRL,5520,Facilitati de cazare pentru vacante si perioade de scurta durata,Sibiu
23245000,IOKI TRANS S.R.L.,4941,Transporturi rutiere de marfuri,Sibiu
23245026,SC ADEXX INDUSTRY SRL,4669,Comert cu ridicata al altor masini si echipamente,Sibiu
23254520,S.C.MIADO SRL,8299,Alte activitati de servicii suport pentru intreprinderi n.c.a.,Sibiu
23254539,SC PHARM2FARM SRL,4690,Comert cu ridicata nespecializat,Sibiu
23254555,S.C.M & A FINANCIAL CONSULTING SRL,6831,Agentii imobiliare,Sibiu
23264800,SC RFTV SRL,4321,Lucrari de instalatii electrice,Sibiu
23264966,SC EURO CHESLER SRL MEDIAS,4332,Lucrari de tamplarie si dulgherie,Sibiu
23265015,SC OMADAX SRL,4711,"Comert cu amanuntul in magazine nespecializate, cu vanzare predominanta de produse alimentare, bauturi si tutun",Sibiu
23302750,SC AUR TRANS SRL,4932,Transporturi cu taxiuri,Sibiu
23302768,IRINA MIRELA,5610,Restaurante,Sibiu
23302784,SC ELECTRO PROMPT INSTAL SRL,4321,Lucrari de instalatii electrice,Sibiu
23314991,SC ARTEMIS GRUP SRL,5520,Facilitati de cazare pentru vacante si perioade de scurta durata,Sibiu
23320799,PETROTYL TRANS SRL,4730,Comert cu amanuntul al carburantilor pentru autovehicule in magazine specializate,Sibiu
23320810,ALCA CO S.R.L.,4334,"Lucrari de vopsitorie, zugraveli si montari de geamuri",Sibiu
23320845,VISION DESIGN SRL,4719,"Comert cu amanuntul in magazine nespecializate, cu vanzare predominanta de produse nealimentare",Sibiu
23320853,S.C. WE-SU CONSTRUCT SRL,150,Activitati in ferme mixte (cultura vegetala combinata cu cresterea animalelor),Sibiu
23336426,S.C. WIEHER SRL,4669,Comert cu ridicata al altor masini si echipamente,Sibiu
23336434,ENDURO SPORT SRL,4941,Transporturi rutiere de marfuri,Sibiu
23336450,PROELCO SRL,4321,Lucrari de instalatii electrice,Sibiu
23336469,ELDAM SRL,4321,Lucrari de instalatii electrice,Sibiu
23336485,VALEX COM S.R.L.,4532,Comert cu amanuntul de piese si accesorii pentru autovehicule,Sibiu
23336540,BIO LIFE SRL,4690,Comert cu ridicata nespecializat,Sibiu
23349876,TOM TRADE SRL,4711,"Comert cu amanuntul in magazine nespecializate, cu vanzare predominanta de produse alimentare, bauturi si tutun",Sibiu
23349884,PHR CLINIQUE SRL,9602,Coafura si alte activitati de infrumusetare,Sibiu
23349914,NATURAL CASA SRL,4729,"Comert cu amanuntul al altor produse alimentare, in magazine specializate",Sibiu
23349949,COST CONSTRUCT SRL,4120,Lucrari de constructii a cladirilor rezidentiale si nerezidentiale,Sibiu
23349965,VISION LEASING IFN SA,6492,Alte activitati de creditare,Sibiu
23350013,S.C Motiva Construct S.R.L,4120,Lucrari de constructii a cladirilor rezidentiale si nerezidentiale,Sibiu
23360599,CON-CONFORT SRL,4110,Dezvoltare (promovare) imobiliara,Sibiu
23372844,TRANS BURGHELEA SRL,4941,Transporturi rutiere de marfuri,Sibiu
23372860,SC GREEN DIAMOND SRL,5520,Facilitati de cazare pentru vacante si perioade de scurta durata,Sibiu
23372887,S.C. DYNAMIC RO S.R.L.,2223,Fabricarea articolelor din material plastic pentru constructii,Sibiu
23372895,STONE COMPANY SRL,4399,Alte lucrari speciale de constructii n.c.a.,Sibiu
23393600,SC SON MANAGEMENT SRL,5814,Activitati de editare a revistelor si periodicelor,Sibiu
23393626,LIBERTY GLOBAL GROUP,6110,Activitati de telecomunicatii prin retele cu cablu,Sibiu
23393642,BEST SOLUTIONS SRL,4690,Comert cu ridicata nespecializat,Sibiu
23406009,ADYS PET SRL,4638,"Comert cu ridicata specializat al altor alimente, inclusiv peste, crustacee si moluste",Sibiu
23406084,SC REPARATII COMPOSITE SRL,210,Silvicultura si alte activitati forestiere,Sibiu
23406092,ALE ROX,4764,"Comert cu amanuntul al echipamentelor sportive, in magazine specializate",Sibiu
23406106,SC TOTAL SERVICE PARCHET SRL,4333,Lucrari de pardosire si placare a peretilor,Sibiu
23406122,SEBY TRANS SRL,4941,Transporturi rutiere de marfuri,Sibiu
23413537,ADENIMO SRL,4759,"Comert cu amanuntul al mobilei, al articolelor de iluminat si al articolelor de uz casnic n.c.a., in magazine specializate",Sibiu
23413642,S.C. ALEX CONSULT SRL,6619,"Activitati auxiliare intermedierilor financiare, exclusiv activitati de asigurari sifonduri de pensii",Sibiu
23425590,S.C. BLANCO 2008 SRL,5630,Baruri si alte activitati de servire a bauturilor,Sibiu
23425620,ALLEGRO CLASS SRL,4771,"Comert cu amanuntul al imbracamintei, in magazine specializate",Sibiu
23432237,NADA TRADING SRL,4779,Comert cu amanuntul al bunurilor de ocazie vandute prin magazine,Sibiu
23432261,SC SMART TOOLS DISTRIBUTION SRL,4662,Comert cu ridicata al masinilor- unelte,Sibiu
23432318,S.C. WERNER CONSTRUCTII SRL,4120,Lucrari de constructii a cladirilor rezidentiale si nerezidentiale,Sibiu
23441758,SC B B SSM CONSULTING SRL,7490,"Alte activitati profesionale, stiintifice si tehnice n.c.a.",Sibiu
23456759,S.C. EURO TRANS TEC SRL,4941,Transporturi rutiere de marfuri,Sibiu
23456805,VALI SRL,5520,Facilitati de cazare pentru vacante si perioade de scurta durata,Sibiu
23466230,STAR CONSULTING SRL,4636,"Comert cu ridicata al zaharului, ciocolatei si produselor zaharoase",Sibiu
23466280,MARK CATERING ARTE SRL,5621,Activitati de alimentatie (catering) pentru evenimente,Sibiu
23483494,MADI INTERTRANS S.R.L.,4941,Transporturi rutiere de marfuri,Sibiu
23483524,SC START LIFT SRL,3312,Repararea masinilor,Sibiu
23483532,S.C. AV DIGITAL S.R.L.,4743,Comert cu amanuntul al echipamentului audio/ video in magazine specializate,Sibiu
23483567,SC INSA SRL,3317,Repararea si intretinerea altor echipamente de transport n.c.a.,Sibiu
23496559,SC AMC SERV CONT SRL,6920,"Activitati de contabilitate si audit financiar, consultanta in domeniul fiscal",Sibiu
23521504,TRANSILVANIA HERITAGE,6831,Agentii imobiliare,Sibiu
23521512,GEALCO MOTORS SRL,4540,"Comert cu motociclete, piese si accesorii aferente, intretinerea si repararea motocicletelor",Sibiu
23521636,TACHO CONTROL S.R.L.,4520,Intretinerea si repararea autovehiculelor,Sibiu
23521733,BADEA CARTAN SRL,1032,Fabricarea sucurilor de fructe si legume,Sibiu
23531710,SC GREAT INVESTMENTS COMPANY SRL,5630,Baruri si alte activitati de servire a bauturilor,Sibiu
23554242,NOVUM SOFTWARE DEVELOPMENT S.R.L.,6201,Activitati de realizare a soft-ului la comanda (software orientat client),Sibiu
23554269,SC DENNIS TRANSPORT SRL,4941,Transporturi rutiere de marfuri,Sibiu
23554285,SOLID INVESTMENT SRL,4110,Dezvoltare (promovare) imobiliara,Sibiu
23554315,UNIC  SECURITY,4321,Lucrari de instalatii electrice,Sibiu
23554323,San Echo SRL,8622,Activitati de asistenta medicala specializata,Sibiu
23554331,PLANETA COPIILOR SRL,4799,"Comert cu amanuntul altfel efectuat in afara  magazinelor, standurilor, chioscurilor si pietelor",Sibiu
23554366,DEA-TRANS SRL,4941,Transporturi rutiere de marfuri,Sibiu
23554382,SC MIRE TRANS CONS SRL,4312,Lucrari de pregatire a terenului,Sibiu
23563160,CONSULTING EXPERT SRL,6831,Agentii imobiliare,Sibiu
23580349,SCHIAU STUDIOS,6201,Activitati de realizare a soft-ului la comanda (software orientat client),Sibiu
23580357,BOG TRANS SRL,4932,Transporturi cu taxiuri,Sibiu
23580420,STIL-MED D&A SRL,4120,Lucrari de constructii a cladirilor rezidentiale si nerezidentiale,Sibiu
23580438,DEPORO IMPEX SRL,4690,Comert cu ridicata nespecializat,Sibiu
23581719,TRANS E SRL,4941,Transporturi rutiere de marfuri,Sibiu
23581760,PREMIER SRL,5520,Facilitati de cazare pentru vacante si perioade de scurta durata,Sibiu
23581786,ENT INC SRL,210,Silvicultura si alte activitati forestiere,Sibiu
23581808,S.C. PAN POMCOM SRL,1071,"Fabricarea painii, fabricarea prajiturilor si a produselor proaspete de patiserie",Sibiu
23581824,SC EURO WOOD SRL,4673,Comert cu ridicata al materialului lemnos si al materialelor de constructii si echipamentelor sanitare,Sibiu
23588440,SC ALRRO 2008 SRL,4677,Comert cu ridicata al deseurilor si resturilor,Sibiu
23588466,PROVIDER SIB SRL,4662,Comert cu ridicata al masinilor- unelte,Sibiu
23588601,ECHELON SRL,6311,"Prelucrarea datelor, administrarea paginilor web si activitati conexe",Sibiu
23588610,SILVCON SRL,4932,Transporturi cu taxiuri,Sibiu
23601166,S.C. CUB ADVERTISING S.R.L.,7311,Activitati ale agentiilor de publicitate,Sibiu
23601212,JAKAB S.R.L.,9512,Repararea echipamentelor de comunicatii,Sibiu
23601220,SC AUTOVISION SRL,4520,Intretinerea si repararea autovehiculelor,Sibiu
23608237,SC EUROTRANZIT SRL,4941,Transporturi rutiere de marfuri,Sibiu
23608270,S.C. GYNMED OBSTETRICA-GINECOLOGIE S.R.L.,8622,Activitati de asistenta medicala specializata,Sibiu
23608296,SC TRUE SOFT SRL,6201,Activitati de realizare a soft-ului la comanda (software orientat client),Sibiu
23629884,GRANIT NEGRU SRL,2370,"Taierea, fasonarea si finisarea pietrei",Sibiu
23630412,OPTIMOB SRL,6810,Cumpararea si vanzarea de bunuri imobiliare proprii,Sibiu
23630439,SC  ESTIMATE INVEST  SRL,6831,Agentii imobiliare,Sibiu
23630455,S.C. AGROMAG SRL,141,Cresterea bovinelor de lapte,Sibiu
23630528,TR PLAST RO SRL,2932,Fabricarea altor piese si accesorii pentru autovehicule si pentru motoare de autovehicule,Sibiu
23630552,TERACON SRL,4120,Lucrari de constructii a cladirilor rezidentiale si nerezidentiale,Sibiu
23630579,SC LUSTRO SRL,4690,Comert cu ridicata nespecializat,Sibiu
23639950,AGFO INVEST S.R.L.,4110,Dezvoltare (promovare) imobiliara,Sibiu
23639993,S.C.TREXICOM SRL.,4671,"Comert cu ridicata al combustibililor solizi, lichizi si gazosi al produselor derivate",Sibiu
23640041,S.C. MERIDIAN SPRINT SRL,4939,Alte transporturi terestre de calatori n.c.a,Sibiu
23667594,ELEMEC S.R.L.,6810,Cumpararea si vanzarea de bunuri imobiliare proprii,Sibiu
23667632,CLICK ON SRL,4673,Comert cu ridicata al materialului lemnos si al materialelor de constructii si echipamentelor sanitare,Sibiu
23670263,RAFSERV 2008 SRL,4719,"Comert cu amanuntul in magazine nespecializate, cu vanzare predominanta de produse nealimentare",Sibiu
23676215,CARMAC SRL,4690,Comert cu ridicata nespecializat,Sibiu
23685892,ACUSTIK SRL,4312,Lucrari de pregatire a terenului,Sibiu
23685922,S.C. AMR EXPERT SRL,6920,"Activitati de contabilitate si audit financiar, consultanta in domeniul fiscal",Sibiu
23685949,RUMA SRL,4120,Lucrari de constructii a cladirilor rezidentiale si nerezidentiale,Sibiu
23695110,ENHANCED SRL,6311,"Prelucrarea datelor, administrarea paginilor web si activitati conexe",Sibiu
23695136,SC COMPLET CONT SRL,6920,"Activitati de contabilitate si audit financiar, consultanta in domeniul fiscal",Sibiu
23695144,SC TATU CONS SRL,7112,Activitati de inginerie si consultanta tehnica legate de acestea,Sibiu
23695233,BIG-T RESTAURANT SRL,5630,Baruri si alte activitati de servire a bauturilor,Sibiu
23704765,SC INTERCREDIT SRL,6622,Activitati ale agentilor si broker-ilor de asigurari,Sibiu
23704773,OLIVE STUDIO SRL,6201,Activitati de realizare a soft-ului la comanda (software orientat client),Sibiu
23704781,IVAN GROUP SRL,5520,Facilitati de cazare pentru vacante si perioade de scurta durata,Sibiu
23717307,S.C. ALU-COR SRL,4612,"Intermedieri in comertul cu combustibili, minereuri, metale si produse chimice pentru industrie",Sibiu
23725164,S.C. SOUND CONCEPT PLUS SRL,9002,Activitati suport pentru interpretare artistica (spectacole),Sibiu
23726925,S.C. CUB PUBLICITAR S.R.L.,7311,Activitati ale agentiilor de publicitate,Sibiu
23732218,Soc. SIBEXCON SRL,6920,"Activitati de contabilitate si audit financiar, consultanta in domeniul fiscal",Sibiu
23732226,MEDICA PREST SRL,8621,Activitati de asistenta medicala generala,Sibiu
23732277,COMEXTERN  SRL,4791,Comert cu amanuntul prin intermediul caselor de comenzi sau prin Internet,Sibiu
23732307,YANKY SRL,9602,Coafura si alte activitati de infrumusetare,Sibiu
23745927,TRAKIA AUTO SRL,4511,"Comert cu autoturisme si autovehicule usoare (sub 3,5 tone)",Sibiu
23745935,A1 SIBIU,7711,Activitati de inchiriere si leasing cu autoturisme si autovehicule rutiere usoare,Sibiu
23745960,DANVET MEDPETCLINIC SRL,7500,Activitati veterinare,Sibiu
23754216,SC ROM VENTURA LOGISTICS &amp; TRADE SRL,4941,Transporturi rutiere de marfuri,Sibiu
23754232,3D CONSULTING BUSINESS,6920,"Activitati de contabilitate si audit financiar, consultanta in domeniul fiscal",Sibiu
23754267,SC RECRUT ART SRL,7810,Activitati ale agentiilor de plasare a fortei de munca,Sibiu
23754305,TEHNO SMART S.R.L,9511,Repararea calculatoarelor si a echipamentelor periferice,Sibiu
23754330,ILY-DYA SRL,3832,Recuperarea materialelor reciclabile sortate,Sibiu
23763800,SC TIVODOR SRL,4941,Transporturi rutiere de marfuri,Sibiu
23769896,"S.C. ""GREENSIB"" S.R.L.",3312,Repararea masinilor,Sibiu
23769934,SC PATY CONSTRUCT SRL,4120,Lucrari de constructii a cladirilor rezidentiale si nerezidentiale,Sibiu
23779520,SC CLEOPATRA SRL,9602,Coafura si alte activitati de infrumusetare,Sibiu
23804292,PACO GLASS S.R.L.,2312,Prelucrarea si fasonarea sticlei plate,Sibiu
23806030,S.C. TRH INVEST S.R.L.,4110,Dezvoltare (promovare) imobiliara,Sibiu
23806064,SC DEZVOLTARI IMOBILIARE SRL,4110,Dezvoltare (promovare) imobiliara,Sibiu
23806072,ALFA DRILL CONSULTING SRL,4619,Intermedieri in comertul cu produse diverse,Sibiu
23806099,CARLEXIM SRL,4711,"Comert cu amanuntul in magazine nespecializate, cu vanzare predominanta de produse alimentare, bauturi si tutun",Sibiu
23806102,SC VITALIS GARDEN AS SRL,8130,Activitati de intretinere peisagistica,Sibiu
23823243,S.C. ECLIPSE IMPEX SRL,4616,"Intermedieri in comertul cu textile, confectii din blana , incaltaminte si articole din piele",Sibiu
23825040,OHS CONSULTING SRL,7490,"Alte activitati profesionale, stiintifice si tehnice n.c.a.",Sibiu
23836049,ACUSTIC EXPERT S.R.L.,7490,"Alte activitati profesionale, stiintifice si tehnice n.c.a.",Sibiu
23836057,GARDINA S.R.L.,8130,Activitati de intretinere peisagistica,Sibiu
23836138,ALY CAMY TRANS SRL,4941,Transporturi rutiere de marfuri,Sibiu
23855520,ROBERT MRM SRL,4540,"Comert cu motociclete, piese si accesorii aferente, intretinerea si repararea motocicletelor",Sibiu
23855636,SALMARIO S.R.L.,4719,"Comert cu amanuntul in magazine nespecializate, cu vanzare predominanta de produse nealimentare",Sibiu
23855660,SC VYO JIULIA SRL,4711,"Comert cu amanuntul in magazine nespecializate, cu vanzare predominanta de produse alimentare, bauturi si tutun",Sibiu
23863728,TRANS NDC SRL,4941,Transporturi rutiere de marfuri,Sibiu
23881619,RIAL,6831,Agentii imobiliare,Sibiu
23890633,FUSION SPIGOTS SRL,4690,Comert cu ridicata nespecializat,Sibiu
23900036,S.C. EBRA CONT SRL,6920,"Activitati de contabilitate si audit financiar, consultanta in domeniul fiscal",Sibiu
23900044,SC MARIL CONSTRUCT SRL,4120,Lucrari de constructii a cladirilor rezidentiale si nerezidentiale,Sibiu
23900133,SMARTEST SRL,5520,Facilitati de cazare pentru vacante si perioade de scurta durata,Sibiu
23906896,SC PRODIVEX SRL,2041,"Fabricarea sapunurilor, detergentilor si a produselor de intretinere",Sibiu
23913060,SC 1 EXPERT T S.R.L.,6920,"Activitati de contabilitate si audit financiar, consultanta in domeniul fiscal",Sibiu
23913109,SCANDINAVIAN CARGO LTD SRL,4941,Transporturi rutiere de marfuri,Sibiu
23926990,ALINEX SRL,4321,Lucrari de instalatii electrice,Sibiu
23927015,AURORA TEX,4719,"Comert cu amanuntul in magazine nespecializate, cu vanzare predominanta de produse nealimentare",Sibiu
23934721,PRO-SIG SRL,7490,"Alte activitati profesionale, stiintifice si tehnice n.c.a.",Sibiu
23939893,FINPREST SRL,8211,Activitati combinate de secretariat,Sibiu
23939907,STAFF CONSULTING & MORE SRL,7820,"Activitati de contractare, pe baze temporare, a personalului",Sibiu
23939915,SP WORK CONSULT SRL,7490,"Alte activitati profesionale, stiintifice si tehnice n.c.a.",Sibiu
23950581,ROBERT & ADI SRL,4631,Comert cu ridicata al fructelor si legumelor,Sibiu
23951781,BIROTEC TELECOM S.R.L.,6110,Activitati de telecomunicatii prin retele cu cablu,Sibiu
23956681,SC FRATII HEIKENS SRL,150,Activitati in ferme mixte (cultura vegetala combinata cu cresterea animalelor),Sibiu
23959424,SC R COLOUR COMPANY SRL,4799,"Comert cu amanuntul altfel efectuat in afara  magazinelor, standurilor, chioscurilor si pietelor",Sibiu
23959459,SC BAV SRL,4941,Transporturi rutiere de marfuri,Sibiu
23962420,ROMSIB PREST S.R.L.,4120,Lucrari de constructii a cladirilor rezidentiale si nerezidentiale,Sibiu
23972377,S.C.INNPROTECH S.R.L.,4669,Comert cu ridicata al altor masini si echipamente,Sibiu
23972385,SC AVANTAJ TEXTIL SRL,4711,"Comert cu amanuntul in magazine nespecializate, cu vanzare predominanta de produse alimentare, bauturi si tutun",Sibiu
23990900,S.C. IMOBILGEST S.R.L.,6831,Agentii imobiliare,Sibiu
23991018,SC RIMI GRUP SRL,4322,"Lucrari de instalatii sanitare, de incalzire si de aer conditionat",Sibiu
23991034,SC INFO CENTER GROUP SRL,8559,Alte forme de invatamant n.c.a.,Sibiu
23996481,AERONAMIC EASTERN EUROPE SRL,3030,Fabricarea de aeronave si nave spatiale,Sibiu
23996511,A.PLAN CONSULTING,7111,Activitati de arhitectura,Sibiu
23996554,S.C. CASTRUM COM SRL,5590,Alte servicii de cazare,Sibiu
23996597,PAUSAN DESIGN SRL,4120,Lucrari de constructii a cladirilor rezidentiale si nerezidentiale,Sibiu
24003683,Zac-Dev Surii Mici SRL,4110,Dezvoltare (promovare) imobiliara,Sibiu
24003691,STUDIO DI BELEZZA S.R.L.,9602,Coafura si alte activitati de infrumusetare,Sibiu
